trans_sk,clt_sk,card_sk,device_sk,event_timestamp,junk_sk,trans_ref_no,trans_destination,dev_ip_location,country_src,country_dest,trans_reason,currency,dest_account_no,trans_amount,time_since_last_trans,distance_from_last_loc,risk_score,new_current_amount,trans_type,trans_status
7240,1769,252,102,2022-09-13T06:57:44.000Z,6,C176908509175997,Jordan Ahli Bank,"Damietta Governorate, Matareya, El-Azhar St.",Jordan,Egypt,Salary,EGP,802114051,9889,56.81,153.0,97.27,14833.5,Deposit,Successful
17240,930,904,84,2025-02-23T15:56:01.000Z,3,C606304003024667,First Abu Dhabi Bank Egypt,"Fayyum Governorate, Nasr City, El-Bustan St.",UAE,Spain,Bill Payment,EUR,349663157,11068,117.64,494.2,86.8,16602.0,Transfer,Successful
37240,811,1527,440,2022-04-23T05:44:49.000Z,5,C715374676148041,Riyad Bank,"Fayyum Governorate, El-Tagammu El-Khames, El-Gomhoreya St.",Canada,Egypt,Salary,EUR,150224366,17785,25.7,115.64,75.49,26677.5,Deposit,Successful
42240,993,1021,263,2019-09-08T15:44:01.000Z,5,C713210910149418,Jordan Ahli Bank,"Giza Governorate, 6th of October, Salah Salem St.",Italy,Egypt,Shopping,EGP,790238083,17417,36.38,368.2,74.51,26125.5,Deposit,Rejected
32240,654,685,444,2022-11-21T11:55:01.000Z,7,C689270819627937,First Abu Dhabi Bank Egypt,"Cairo Governorate, Garden City, Gamal Abdel Nasser St.",Australia,Italy,Transfer,USD,206138337,19396,113.36,153.31,96.9,29094.0,Transfer,Successful
2240,1568,616,63,2025-12-07T12:14:14.000Z,1,C708942523105480,Saeed Younis Naguib Saleh,"New Valley Governorate, El-Haram, El-Haram St.",Australia,UK,Shopping,EUR,274192509,10502,79.32,3.69,88.3,15753.0,Transfer,Rejected
47240,906,1444,485,2025-08-10T05:38:13.000Z,7,C371496211366573,Lebanese French Bank (LFB),"Suez Governorate, New Cairo, El-Alfy St.",Australia,Egypt,Salary,USD,189511089,17847,75.49,259.9,89.57,26770.5,Deposit,Successful
12241,1699,1966,35,2022-09-16T03:54:18.000Z,6,C286502431954700,Bank of Alexandria,"Alexandria Governorate, El-Shorouk, Cleopatra St.",Canada,Italy,Transfer,EGP,149421092,16452,31.58,404.55,93.49,24678.0,Transfer,Rejected
17241,894,1796,72,2026-04-07T14:03:54.000Z,3,C748123943721445,Fransabank,"Ismailia Governorate, 6th of October, El-Mohandiseen St.",UK,Australia,Transfer,EGP,299666489,6212,2.7,449.48,80.12,9318.0,Transfer,Rejected
7241,566,1063,346,2023-08-20T14:23:41.000Z,1,C235819178909903,BLOM Bank,"New Valley Governorate, El-Haram, Emad El-Din St.",UK,Egypt,Salary,USD,960776031,11052,0.61,336.16,95.85,16578.0,Withdrawal,Rejected
22241,207,338,12,2024-06-19T05:18:56.000Z,7,C320881928373151,First Abu Dhabi Bank (FAB),"Beni Suef Governorate, Sheikh Zayed, El-Nasr St.",Saudi Arabia,Spain,Salary,EGP,337030145,7525,78.81,157.75,86.26,11287.5,Transfer,Successful
37241,214,1596,139,2020-12-27T11:24:59.000Z,2,C706751673800596,Ahli United Bank Kuwait,"New Valley Governorate, Madinaty, Champollion St.",UK,Germany,Transfer,USD,642350975,9200,105.06,390.91,88.61,13800.0,Transfer,Successful
27241,36,732,279,2015-11-17T01:16:00.000Z,7,C681431435834294,First Abu Dhabi Bank (FAB),"Tanta Governorate, Badr City, Emad El-Din St.",UAE,Egypt,Bill Payment,EUR,908367566,19949,0.73,105.38,83.39,29923.5,Withdrawal,Successful
2241,23,611,476,2020-07-22T03:48:18.000Z,6,C171168978066627,Commercial International Bank (CIB),"Arish Governorate, Mohandiseen, Corniche El-Nil St.",USA,Egypt,Transfer,USD,574445522,8765,17.64,214.68,71.94,13147.5,Withdrawal,Successful
42241,781,1473,489,2016-07-23T03:13:11.000Z,4,C105236858572843,Gulf Bank Kuwait,"Beni Suef Governorate, El-Salam, El-Galaa St.",Germany,Egypt,Bill Payment,USD,649265237,9955,39.51,449.35,99.83,14932.5,Withdrawal,Successful
47241,1146,41,195,2018-01-31T11:47:26.000Z,2,C563376660781019,Abu Dhabi Islamic Bank (ADIB),"Arish Governorate, El-Marg, Corniche El-Nil St.",Australia,Germany,Transfer,EGP,773198773,9631,22.35,143.13,91.02,14446.5,Transfer,Rejected
32241,1363,19,80,2015-12-25T23:39:49.000Z,1,C868200629030567,Arab Investment Bank,"Damietta Governorate, Garden City, El-Mohandiseen St.",Germany,Egypt,Shopping,EUR,383271894,3879,60.26,174.79,30.59,5818.5,Deposit,Rejected
12242,1508,1228,484,2018-06-15T18:22:34.000Z,6,C790788400052465,Qatar National Bank (QNB),"Arish Governorate, El-Salam, El-Azhar St.",Spain,Egypt,Salary,USD,270701346,11995,82.47,325.19,81.3,17992.5,Deposit,Rejected
7242,584,316,337,2020-12-10T18:31:29.000Z,3,C211329264845336,BLOM Bank,"Hurghada Governorate, Faisal, El-Nasr St.",USA,Italy,Transfer,USD,261469813,7639,15.56,53.94,77.57,11458.5,Transfer,Successful
17242,1419,332,412,2019-11-24T22:35:27.000Z,3,C195293602286107,Arab Jordan Investment Bank,"Giza Governorate, Garden City, Ramses St.",Egypt,Egypt,Bill Payment,EGP,593433388,14646,43.82,367.55,79.74,21969.0,Deposit,Successful
22242,609,626,94,2022-06-02T18:22:05.000Z,6,C406889034024062,Amira Qassem Abdel-Rahman Sayed,"Aswan Governorate, Garden City, Cleopatra St.",Saudi Arabia,Egypt,Transfer,USD,409170862,2297,76.56,155.28,37.76,3445.5,Withdrawal,Successful
37242,549,1036,113,2018-10-09T08:50:25.000Z,5,C718638608669667,Arab National Bank,"Beni Suef Governorate, Madinaty, Makram Ebeid St.",UK,USA,Shopping,USD,559901644,3629,28.37,185.81,25.58,5443.5,Transfer,Successful
27242,1814,868,153,2020-04-17T21:40:26.000Z,3,C172764734544359,Arab Jordan Investment Bank,"Fayyum Governorate, El-Obour City, El-Batal Ahmed Abdel Aziz St.",Italy,Italy,Shopping,USD,767123780,8255,6.96,103.67,89.89,12382.5,Transfer,Successful
47242,65,1547,130,2017-07-26T06:08:16.000Z,4,C644168356888952,Arab African International Bank (AAIB),"Tanta Governorate, Ain Shams, Port Said St.",UAE,Egypt,Shopping,USD,331131232,8769,99.55,480.17,75.05,13153.5,Withdrawal,Rejected
32242,71,1304,438,2021-09-14T19:34:27.000Z,2,C182437835960338,Qatar National Bank (QNB),"Beni Suef Governorate, Heliopolis, Merghany St.",UK,Egypt,Shopping,EGP,679872847,18920,75.52,224.51,79.39,28380.0,Deposit,Successful
2242,210,1861,258,2022-05-27T19:31:06.000Z,7,C873044289725479,Bank Misr,"Qena Governorate, Rehab City, Ramses St.",Italy,Egypt,Shopping,EGP,458130596,1953,5.39,83.19,8.12,2929.5,Withdrawal,Successful
42242,1225,313,259,2024-09-22T03:31:15.000Z,6,C379183376806435,Egyptian Arab Land Bank,"Marsa Matrouh Governorate, El-Salam, Talaat Harb St.",Canada,Egypt,Shopping,EUR,964218614,11076,17.17,73.91,81.99,16614.0,Deposit,Successful
12243,206,1004,294,2020-05-29T05:18:25.000Z,4,C817852236526045,Commercial Bank of Qatar,"New Valley Governorate, Heliopolis, Gamal Abdel Nasser St.",France,Egypt,Bill Payment,EUR,302446568,9881,118.12,475.42,71.83,14821.5,Deposit,Rejected
7243,1155,1027,469,2019-10-29T19:47:21.000Z,7,C199056626837356,Kuwait Finance House,"Luxor Governorate, Badr City, Sudan St.",Australia,Egypt,Transfer,USD,597151766,6119,50.79,207.25,81.4,9178.5,Deposit,Rejected
22243,1501,1141,52,2022-12-14T15:27:20.000Z,5,C233205092892794,Arab Jordan Investment Bank,"Marsa Matrouh Governorate, Mohandiseen, Champollion St.",UK,Egypt,Shopping,EGP,826810756,18887,34.65,110.41,70.64,28330.5,Deposit,Successful
27243,1728,1349,41,2017-05-03T05:41:48.000Z,3,C191174173955197,Gulf Bank Kuwait,"Sohag Governorate, Heliopolis, El-Alfy St.",Egypt,Egypt,Shopping,USD,460255010,5997,100.69,496.34,76.75,8995.5,Withdrawal,Rejected
17243,1621,204,248,2020-01-13T10:09:15.000Z,2,C164869351261626,Housing and Development Bank (HDB),"Suez Governorate, Zamalek, El-Nasr St.",Jordan,Australia,Bill Payment,EGP,400087323,16138,53.41,59.18,96.71,24207.0,Transfer,Rejected
37243,439,956,20,2018-06-24T09:11:11.000Z,5,C455057054962233,Arab Bank,"Tanta Governorate, Hadayek El-Qobba, El-Gomhoreya St.",UAE,Egypt,Shopping,USD,928998770,2407,92.41,479.3,25.83,3610.5,Deposit,Successful
42243,361,6,342,2021-02-20T09:16:23.000Z,1,C650140979663382,Al Ahly Bank,"Luxor Governorate, Imbaba, El-Tahrir St.",Lebanon,Egypt,Bill Payment,EUR,592366693,9893,16.54,96.64,83.68,14839.5,Withdrawal,Successful
2243,1988,925,320,2021-01-26T00:06:24.000Z,5,C420802361477471,Bank Misr,"Hurghada Governorate, El-Salam, Sudan St.",Egypt,Egypt,Transfer,USD,103983500,12459,9.24,131.17,74.09,18688.5,Withdrawal,Rejected
47243,64,372,147,2024-07-12T08:02:58.000Z,2,C716544075668461,Qatar National Bank (QNB),"Fayyum Governorate, El-Haram, El-Nasr St.",UK,Egypt,Bill Payment,EGP,266348167,14758,87.91,334.63,95.05,22137.0,Withdrawal,Rejected
32243,1483,1728,75,2022-04-03T22:39:25.000Z,3,C381324139574691,Ahli Bank of Qatar,"Zagazig Governorate, 6th of October, El-Gomhoreya St.",Italy,Egypt,Shopping,USD,670256622,15222,111.85,341.84,79.49,22833.0,Deposit,Successful
12244,1083,865,72,2024-10-04T23:20:14.000Z,4,C386205182902983,Arab Bank,"Ismailia Governorate, 6th of October, El-Mohandiseen St.",UAE,Egypt,Shopping,EUR,987436320,14763,34.66,129.51,81.12,22144.5,Deposit,Rejected
7244,1351,1069,10,2025-12-08T05:37:55.000Z,4,C391733020598834,BLOM Bank,"Damanhur Governorate, 6th of October, Sudan St.",UAE,Egypt,Transfer,USD,138513286,1269,6.56,406.88,19.39,1903.5,Deposit,Rejected
37244,315,1828,407,2026-02-04T10:04:20.000Z,6,C326434677164521,Saudi National Bank (SNB),"Tanta Governorate, Matareya, Champollion St.",Spain,Egypt,Shopping,USD,197297105,4964,110.65,248.74,18.73,7446.0,Withdrawal,Successful
27244,1470,1752,427,2017-07-27T01:19:58.000Z,7,C797764601839127,BLOM Bank,"Luxor Governorate, Heliopolis, El-Ahrar St.",UK,Egypt,Salary,EUR,206736519,15594,33.59,100.52,77.88,23391.0,Deposit,Rejected
22244,1756,138,236,2021-02-14T19:49:29.000Z,4,C538215721785697,Kuwait Finance House,"Sohag Governorate, El-Shorouk, Makram Ebeid St.",France,Egypt,Salary,EGP,104466287,18309,7.73,473.3,74.01,27463.5,Deposit,Successful
17244,846,1838,344,2015-04-02T09:22:34.000Z,5,C620514912404188,Faisal Islamic Bank of Egypt,"Arish Governorate, Zamalek, El-Bustan St.",Canada,Egypt,Salary,USD,790925403,10530,28.46,334.78,83.58,15795.0,Withdrawal,Rejected
42244,1575,668,6,2023-04-21T05:57:23.000Z,1,C971479362195095,Ahli Bank of Qatar,"Luxor Governorate, Garden City, Merghany St.",Lebanon,Egypt,Transfer,EGP,486180423,7126,20.13,292.86,73.78,10689.0,Withdrawal,Rejected
2244,1859,1760,492,2025-02-17T15:30:06.000Z,3,C943925896191251,Suez Canal Bank,"Zagazig Governorate, Omraneya, Emad El-Din St.",Saudi Arabia,Canada,Bill Payment,USD,750513917,12187,40.91,70.31,80.16,18280.5,Transfer,Rejected
32244,1143,903,165,2015-03-25T22:48:38.000Z,4,C178024945278422,National Bank of Kuwait,"Asyut Governorate, El-Shorouk, El-Azhar St.",USA,Egypt,Shopping,EUR,891765953,17781,33.92,483.11,87.57,26671.5,Withdrawal,Successful
47244,901,141,385,2019-06-27T02:09:27.000Z,4,C828548149090196,First Abu Dhabi Bank (FAB),"Mansoura Governorate, Zamalek, Adly St.",France,France,Salary,USD,627520193,10438,107.01,186.93,90.4,15657.0,Transfer,Successful
12245,155,1402,377,2024-12-26T19:43:43.000Z,3,C942305838761273,Ahli United Bank Egypt,"Tanta Governorate, Agouza, El-Mohandiseen St.",UAE,Egypt,Bill Payment,USD,465517676,14566,21.53,412.66,99.6,21849.0,Deposit,Successful
37245,1979,1554,121,2023-07-25T15:22:15.000Z,2,C461716704505340,Byblos Bank,"Arish Governorate, El-Basatin, Makram Ebeid St.",Australia,Egypt,Salary,USD,718646816,6826,96.28,402.7,77.06,10239.0,Deposit,Rejected
17245,1752,1125,96,2016-10-21T04:02:38.000Z,4,C462913430925995,National Bank of Kuwait,"Shubra El-Kheima Governorate, El-Basatin, El-Bustan St.",Saudi Arabia,Egypt,Shopping,EGP,819396016,11534,22.43,145.07,95.99,17301.0,Withdrawal,Rejected
27245,1701,128,162,2021-03-19T14:13:14.000Z,6,C489683243759121,Arab African International Bank (AAIB),"Minya Governorate, Rehab City, Ramses St.",Lebanon,Egypt,Transfer,USD,824228082,14860,15.14,414.5,92.5,22290.0,Withdrawal,Successful
22245,868,269,416,2015-02-15T23:52:55.000Z,3,C268975694025680,Al Ahly Bank,"Ismailia Governorate, Shubra, El-Haram St.",Egypt,Italy,Transfer,EUR,897856302,1751,16.56,186.77,23.44,2626.5,Transfer,Rejected
7245,111,1709,125,2021-07-13T00:24:10.000Z,3,C190375204316248,Riyad Bank,"Marsa Matrouh Governorate, Mohandiseen, El-Gomhoreya St.",UK,Egypt,Shopping,USD,503444878,12188,73.26,434.49,89.61,18282.0,Withdrawal,Rejected
42245,1097,620,23,2019-07-15T03:22:55.000Z,5,C734430236543122,Housing and Development Bank (HDB),"Aswan Governorate, Zamalek, El-Azhar St.",Germany,Egypt,Shopping,EUR,968925655,19483,118.03,406.3,82.57,29224.5,Withdrawal,Rejected
32245,380,1857,98,2017-08-01T22:00:45.000Z,3,C970024594022469,Ibrahim Mansour Younis Shafik,"Aswan Governorate, Omraneya, Ramses St.",UK,Egypt,Salary,EUR,503284327,13779,79.88,75.07,82.18,20668.5,Withdrawal,Rejected
47245,1481,637,103,2015-12-11T22:39:26.000Z,7,C588630281902123,First Abu Dhabi Bank Egypt,"Fayyum Governorate, Sheikh Zayed, Cleopatra St.",Italy,Egypt,Shopping,EUR,413858486,2389,76.38,73.71,33.18,3583.5,Deposit,Successful
2245,1767,419,211,2025-01-27T04:08:22.000Z,1,C632213745156129,Banque Saudi Fransi,"Aswan Governorate, El-Salam, El-Alfy St.",Canada,UK,Shopping,EGP,230975488,3473,84.42,351.8,11.14,5209.5,Transfer,Rejected
12246,651,523,346,2020-11-03T23:39:25.000Z,6,C191464579392983,Al Rajhi Bank,"New Valley Governorate, El-Haram, Emad El-Din St.",Saudi Arabia,Egypt,Salary,USD,126483546,6145,115.36,28.35,74.27,9217.5,Withdrawal,Rejected
27246,2000,1842,297,2016-01-24T11:15:25.000Z,5,C489966922052032,Emirates NBD,"Ismailia Governorate, El-Shorouk, El-Ahrar St.",Lebanon,Egypt,Salary,EGP,841506896,441,58.8,462.0,28.53,661.5,Deposit,Successful
7246,1795,1856,426,2019-10-26T10:19:23.000Z,7,C235630987648397,Fransabank,"Tanta Governorate, El-Marg, Kasr El-Nil St.",UAE,Australia,Bill Payment,EGP,128550946,3830,22.56,350.3,3.28,5745.0,Transfer,Successful
17246,92,1486,272,2020-06-22T00:19:10.000Z,7,C621228435767153,Arab African International Bank (AAIB),"Damietta Governorate, El-Shorouk, Port Said St.",Lebanon,Canada,Bill Payment,USD,163400669,18567,99.29,192.28,81.53,27850.5,Transfer,Successful
37246,1732,633,478,2015-08-15T20:40:15.000Z,7,C596865201732713,Qatar National Bank (QNB),"Beni Suef Governorate, El-Haram, El-Haram St.",Italy,Egypt,Salary,USD,611494410,8453,51.05,264.51,70.08,12679.5,Deposit,Successful
22246,498,1228,21,2025-02-10T21:55:35.000Z,7,C246930501579466,Housing and Development Bank (HDB),"Shubra El-Kheima Governorate, Madinaty, Abbas El-Akkad St.",UAE,Australia,Transfer,USD,100446415,17196,30.93,488.3,87.03,25794.0,Transfer,Rejected
47246,1801,80,158,2024-09-08T22:56:45.000Z,3,C874212549618928,Jordan Ahli Bank,"Asyut Governorate, El-Haram, Salah Salem St.",UK,Egypt,Shopping,EGP,851769325,10966,15.36,348.51,87.26,16449.0,Deposit,Rejected
42246,1785,1554,25,2015-05-07T11:56:19.000Z,3,C546112782730329,Bank Misr,"Shubra El-Kheima Governorate, El-Basatin, Cleopatra St.",Spain,Italy,Salary,EGP,510612903,14400,26.61,76.6,75.13,21600.0,Transfer,Successful
2246,981,1484,139,2017-12-24T21:49:25.000Z,2,C530701858394967,Ahli Bank of Qatar,"New Valley Governorate, Madinaty, Champollion St.",Australia,Egypt,Bill Payment,EUR,619871814,12563,101.2,207.65,91.97,18844.5,Deposit,Rejected
32246,1413,1514,336,2022-06-23T16:05:59.000Z,4,C499656789486199,Arab Jordan Investment Bank,"Asyut Governorate, El-Marg, Ramses St.",Australia,Egypt,Bill Payment,USD,158995296,8187,11.45,77.86,78.12,12280.5,Deposit,Successful
12247,399,1543,445,2025-12-28T15:06:26.000Z,4,C708772762537271,Banque du Caire,"Tanta Governorate, El-Shorouk, El-Galaa St.",UK,Egypt,Shopping,EGP,485693375,5807,62.36,431.03,72.71,8710.5,Deposit,Rejected
27247,1928,689,102,2018-09-03T11:31:52.000Z,3,C841828774670920,Kuwait Finance House,"Damietta Governorate, Matareya, El-Azhar St.",Saudi Arabia,Egypt,Transfer,EGP,803051092,595,104.43,33.13,21.52,892.5,Withdrawal,Rejected
17247,1725,154,330,2025-09-02T22:22:53.000Z,7,C612996479336725,Al Ahly Bank,"Aswan Governorate, Madinaty, Salah Salem St.",Italy,Egypt,Transfer,EGP,194642936,1025,30.14,464.47,21.02,1537.5,Deposit,Successful
37247,1392,1795,43,2015-08-21T02:21:04.000Z,1,C700739868046327,Asmaa Abdel-Rahman Hilal Amer,"Sohag Governorate, El-Marg, Merghany St.",UAE,Egypt,Shopping,EGP,445207823,4642,56.81,94.59,19.52,6963.0,Deposit,Successful
22247,1327,1920,40,2021-04-09T17:49:43.000Z,7,C545258459618180,Mostafa Sayed Lotfy Zaki,"Mansoura Governorate, Mohandiseen, Emad El-Din St.",Australia,Egypt,Transfer,EGP,584970463,7234,12.59,289.74,81.96,10851.0,Withdrawal,Rejected
7247,1843,331,478,2019-03-12T01:44:26.000Z,4,C452399590763152,Faisal Islamic Bank of Egypt,"Beni Suef Governorate, El-Haram, El-Haram St.",Egypt,Egypt,Salary,EGP,804732711,8532,71.38,73.87,84.1,12798.0,Deposit,Successful
32247,1327,1496,7,2024-11-03T21:10:23.000Z,7,C440658633997397,Housing and Development Bank (HDB),"Asyut Governorate, Maadi, El-Safwa St.",Canada,Egypt,Bill Payment,EUR,130870203,7392,20.34,341.09,77.29,11088.0,Deposit,Successful
2247,638,1264,423,2023-10-30T19:24:01.000Z,5,C166063567334556,Suez Canal Bank,"Cairo Governorate, Madinaty, Merghany St.",USA,Italy,Transfer,EGP,795782486,1717,32.92,341.5,17.86,2575.5,Transfer,Rejected
42247,803,1721,425,2021-12-16T17:43:21.000Z,6,C823254739155377,Emirates NBD Egypt,"Tanta Governorate, Madinaty, El-Galaa St.",Egypt,Egypt,Shopping,USD,633719597,5520,5.39,425.5,80.49,8280.0,Deposit,Rejected
47247,1590,887,220,2024-05-06T16:59:38.000Z,4,C984575781783733,Ahli United Bank Kuwait,"Mansoura Governorate, Boulak, Adly St.",Egypt,Egypt,Transfer,EGP,148562771,12951,0.93,52.94,72.64,19426.5,Withdrawal,Successful
12248,15,1258,487,2018-06-04T19:47:43.000Z,1,C137686331840737,Abu Dhabi Islamic Bank (ADIB),"Damanhur Governorate, Madinaty, El-Alfy St.",USA,Australia,Bill Payment,EGP,238795758,10890,23.19,36.42,87.96,16335.0,Transfer,Rejected
17248,1267,108,472,2017-12-08T20:34:50.000Z,3,C732496631547395,Hazem Zaki Naguib Saleh,"Minya Governorate, Imbaba, El-Batal Ahmed Abdel Aziz St.",France,Egypt,Shopping,USD,706301512,6198,107.99,311.42,90.96,9297.0,Withdrawal,Successful
37248,283,1506,146,2020-06-02T09:32:22.000Z,2,C351269240535195,Housing and Development Bank (HDB),"Asyut Governorate, Dokki, El-Batal Ahmed Abdel Aziz St.",Jordan,Canada,Transfer,EUR,663086909,3214,7.04,234.78,15.11,4821.0,Transfer,Successful
22248,828,1907,78,2016-02-09T03:09:37.000Z,3,C111217036944497,Al Rajhi Bank,"Aswan Governorate, El-Basatin, El-Gomhoreya St.",Germany,Canada,Shopping,EGP,322435653,1424,80.18,458.64,12.36,2136.0,Transfer,Rejected
27248,1243,937,347,2024-02-13T14:11:47.000Z,1,C194386443331762,Arab African International Bank (AAIB),"Shubra El-Kheima Governorate, Maadi, El-Ahrar St.",UK,Australia,Salary,USD,889943293,10671,110.87,225.14,70.13,16006.5,Transfer,Successful
7248,1011,904,368,2021-02-10T03:48:27.000Z,2,C383644637420832,Arab Investment Bank,"Tanta Governorate, El-Basatin, Emad El-Din St.",Egypt,Egypt,Shopping,EUR,450931644,8439,97.5,190.99,85.71,12658.5,Withdrawal,Rejected
32248,37,1366,432,2025-04-27T14:50:43.000Z,6,C204676549629926,Kamal Zidan Helal Hamdy,"Arish Governorate, Heliopolis, Corniche El-Nil St.",France,Egypt,Transfer,EUR,267197524,6969,36.59,396.99,86.79,10453.5,Withdrawal,Successful
42248,1072,549,260,2017-07-11T02:43:25.000Z,6,C264235909612095,National Commercial Bank (NCB),"Cairo Governorate, Dokki, El-Alfy St.",USA,Egypt,Salary,EGP,491802052,4785,118.69,94.72,28.26,7177.5,Deposit,Successful
2248,1341,237,475,2015-03-07T20:31:53.000Z,1,C116560172765675,Commercial Bank of Dubai,"Tanta Governorate, Zamalek, El-Sheikh Rihan St.",UK,Egypt,Transfer,EGP,344661745,15850,3.14,297.78,92.78,23775.0,Withdrawal,Rejected
47248,1631,725,366,2018-04-06T02:45:55.000Z,3,C929114245586059,National Bank of Kuwait,"Tanta Governorate, Mohandiseen, El-Alfy St.",Egypt,Egypt,Salary,USD,877494214,11863,30.91,193.37,75.83,17794.5,Deposit,Rejected
12249,665,1801,4,2021-04-13T03:21:47.000Z,4,C490757153185397,Asmaa Bishara Farhat Sobhi,"Tanta Governorate, El-Obour City, Mohamed Naguib St.",Australia,UK,Salary,EUR,494600820,6055,12.92,54.99,94.92,9082.5,Transfer,Rejected
27249,382,1504,138,2018-06-02T05:08:19.000Z,4,C340692083387672,Suez Canal Bank,"Cairo Governorate, El-Shorouk, Ramses St.",Spain,Italy,Transfer,EUR,600818511,5422,42.02,44.43,83.37,8133.0,Transfer,Successful
7249,183,1801,323,2020-04-22T03:04:37.000Z,7,C885874613703177,Gulf Bank Kuwait,"New Valley Governorate, Nasr City, Merghany St.",USA,Egypt,Shopping,USD,458552996,3581,25.97,265.82,38.28,5371.5,Withdrawal,Rejected
37249,1930,311,374,2017-05-19T12:13:14.000Z,3,C884446417678084,Bank Misr,"Beni Suef Governorate, Agouza, El-Safwa St.",UK,Egypt,Transfer,EUR,123765281,17203,117.22,464.63,73.31,25804.5,Withdrawal,Rejected
22249,1141,861,362,2017-11-29T13:39:30.000Z,7,C525223828103029,Kuwait Finance House,"Minya Governorate, Heliopolis, Ramses St.",Canada,Egypt,Shopping,USD,551618245,5619,63.34,74.92,91.19,8428.5,Deposit,Successful
17249,1901,627,83,2022-09-27T10:07:49.000Z,6,C842821658861022,Fransabank,"Damanhur Governorate, El-Shorouk, El-Safwa St.",Lebanon,France,Bill Payment,EGP,234219079,7683,109.59,452.6,89.62,11524.5,Transfer,Rejected
32249,1294,101,252,2019-11-13T09:14:25.000Z,3,C811480595784547,Qatar National Bank (QNB),"Hurghada Governorate, Agouza, El-Tahrir St.",Canada,Australia,Bill Payment,EGP,950649869,8704,3.35,309.17,76.13,13056.0,Transfer,Rejected
2249,1023,868,172,2019-11-16T04:55:19.000Z,3,C562262194165187,Al Baraka Bank Egypt,"Ismailia Governorate, Dokki, Champollion St.",Jordan,UK,Bill Payment,EUR,898804919,8608,39.47,437.91,72.14,12912.0,Transfer,Successful
47249,1475,59,343,2016-05-14T13:51:12.000Z,1,C325077517875937,Noha Mohamed Mohamed Metwaly,"Cairo Governorate, El-Tagammu El-Khames, El-Galaa St.",UAE,USA,Shopping,EUR,269435283,9783,32.41,243.97,86.86,14674.5,Transfer,Rejected
42249,1414,470,335,2022-08-30T16:41:20.000Z,7,C986225573171483,Commercial Bank of Dubai,"Suez Governorate, El-Salam, El-Ahrar St.",UK,Egypt,Transfer,EGP,481313281,7608,85.87,307.59,88.71,11412.0,Deposit,Successful
12250,1996,426,89,2016-09-23T09:43:12.000Z,7,C831320232398969,Arab Investment Bank,"Aswan Governorate, Mohandiseen, Emad El-Din St.",Spain,Egypt,Transfer,EGP,731550266,14681,74.77,114.15,89.4,22021.5,Deposit,Rejected
37250,1078,88,413,2016-05-22T07:39:46.000Z,2,C491367138943668,Gulf Bank Kuwait,"Aswan Governorate, El-Salam, Salah Salem St.",Germany,USA,Shopping,USD,100442997,19426,58.85,171.77,70.03,29139.0,Transfer,Successful
7250,575,351,105,2021-03-04T00:05:21.000Z,5,C705554741282277,Al Baraka Bank Egypt,"Minya Governorate, New Cairo, El-Galaa St.",Canada,Egypt,Transfer,USD,505544614,8386,29.47,366.57,99.08,12579.0,Withdrawal,Successful
17250,527,823,413,2015-08-16T04:30:28.000Z,6,C848817082535317,Khaled Naguib Zidan Mansour,"Aswan Governorate, El-Salam, Salah Salem St.",Egypt,Egypt,Shopping,EUR,480323674,1205,5.08,258.48,31.46,1807.5,Withdrawal,Rejected
27250,1824,917,294,2023-12-23T05:39:10.000Z,5,C428535794400835,UBS,"New Valley Governorate, Heliopolis, Gamal Abdel Nasser St.",Jordan,Egypt,Transfer,EGP,253900498,5461,108.61,397.89,79.81,8191.5,Deposit,Rejected
22250,1740,1150,384,2021-08-15T06:23:23.000Z,5,C720312501960674,Bank of Alexandria,"Beni Suef Governorate, El-Sharabia, El-Bustan St.",Egypt,Egypt,Bill Payment,EUR,733268112,5637,20.76,28.96,95.31,8455.5,Deposit,Successful
42250,1637,952,25,2016-11-13T06:32:52.000Z,6,C878858769389000,Emirates NBD,"Shubra El-Kheima Governorate, El-Basatin, Cleopatra St.",UK,Australia,Salary,EUR,661648280,17248,68.93,99.54,88.98,25872.0,Transfer,Successful
47250,297,252,484,2024-12-03T03:06:21.000Z,4,C263358000387310,First Abu Dhabi Bank Egypt,"Arish Governorate, El-Salam, El-Azhar St.",Lebanon,Egypt,Shopping,EUR,540904277,1186,32.65,455.59,3.11,1779.0,Deposit,Rejected
2250,1833,636,458,2022-08-31T13:31:39.000Z,5,C440060525343153,Bank of Alexandria,"Shubra El-Kheima Governorate, Sheikh Zayed, El-Ahrar St.",Jordan,Germany,Transfer,EUR,121035926,6472,87.45,286.25,87.81,9708.0,Transfer,Rejected
32250,397,798,356,2018-08-21T09:49:13.000Z,2,C765100158278661,Kareem Hussein Farhat Younis,"Port Said Governorate, Zamalek, Salah Salem St.",France,Egypt,Bill Payment,EUR,550882492,1585,116.1,424.26,9.8,2377.5,Withdrawal,Rejected
12251,246,454,399,2016-02-28T14:03:06.000Z,4,C527681680834843,Arab Bank,"Qena Governorate, Faisal, El-Azhar St.",Germany,Spain,Transfer,USD,815380448,6443,118.85,166.75,87.79,9664.5,Transfer,Successful
7251,1877,736,122,2023-10-16T04:22:39.000Z,5,C848798174245840,First Abu Dhabi Bank Egypt,"Zagazig Governorate, Shubra, El-Safwa St.",USA,Egypt,Shopping,EUR,126237951,10006,37.67,436.52,81.0,15009.0,Withdrawal,Successful
22251,1681,1493,443,2025-09-19T14:22:52.000Z,4,C517632533873232,Bank of Alexandria,"Damanhur Governorate, Heliopolis, El-Azhar St.",UK,Egypt,Bill Payment,USD,177596229,135,88.58,309.17,38.38,202.5,Withdrawal,Successful
37251,218,1274,88,2022-08-22T11:51:55.000Z,1,C317924775229775,First Abu Dhabi Bank (FAB),"Arish Governorate, El-Sharabia, El-Bustan St.",Spain,Egypt,Shopping,EUR,723672053,7645,118.81,400.4,80.06,11467.5,Deposit,Rejected
17251,1037,1508,483,2018-12-01T06:07:57.000Z,3,C870827322449132,Lebanese French Bank (LFB),"Cairo Governorate, El-Sharabia, Champollion St.",Lebanon,UK,Shopping,USD,295392024,14358,52.21,89.52,88.16,21537.0,Transfer,Successful
27251,822,1800,332,2025-12-18T05:40:28.000Z,4,C251721633166373,Banque du Caire,"Sohag Governorate, 6th of October, Emad El-Din St.",Canada,Spain,Salary,USD,507896429,13182,5.23,116.37,81.69,19773.0,Transfer,Rejected
42251,1087,1920,463,2021-06-26T02:42:55.000Z,1,C328015651067807,Arab Bank,"Minya Governorate, Hadayek El-Qobba, El-Orouba St.",Lebanon,Egypt,Bill Payment,USD,855523404,405,42.86,13.3,9.4,607.5,Deposit,Rejected
47251,1903,928,490,2017-12-18T06:48:50.000Z,6,C949564679929917,QNB Al Ahli,"Sohag Governorate, El-Tagammu El-Khames, El-Mohandiseen St.",Lebanon,Egypt,Bill Payment,EGP,460463507,6965,25.93,58.16,88.91,10447.5,Withdrawal,Successful
2251,802,1776,457,2016-01-24T05:52:02.000Z,5,C536247484647573,Qatar National Bank (QNB),"Shubra El-Kheima Governorate, Shubra, Corniche El-Nil St.",UAE,Egypt,Transfer,EUR,382068868,3001,43.52,465.91,36.16,4501.5,Deposit,Successful
