trans_sk,clt_sk,card_sk,device_sk,event_timestamp,junk_sk,trans_ref_no,trans_destination,dev_ip_location,country_src,country_dest,trans_reason,currency,dest_account_no,trans_amount,time_since_last_trans,distance_from_last_loc,risk_score,new_current_amount,trans_type,trans_status
39695,1792,690,470,2020-06-17T14:28:44.000Z,1,C288390052366154,Faisal Islamic Bank of Egypt,"Damietta Governorate, Shubra, El-Gomhoreya St.",Australia,Egypt,Shopping,USD,681104328,16294,78.17,3.87,86.96,24441.0,Deposit,Successful
19695,1301,1357,53,2020-04-22T07:27:30.000Z,3,C473542624100758,Banque du Caire,"Aswan Governorate, New Cairo, Emad El-Din St.",UAE,France,Shopping,EGP,928289903,12896,38.58,285.74,97.44,19344.0,Transfer,Rejected
34695,158,1694,49,2017-07-14T03:07:00.000Z,1,C604462162143774,Arab Bank,"Damanhur Governorate, New Cairo, Abbas El-Akkad St.",Lebanon,Egypt,Bill Payment,EUR,351825226,14014,102.86,58.44,86.51,21021.0,Withdrawal,Rejected
4695,1306,1087,275,2022-04-25T07:15:38.000Z,5,C452073350722864,Bank of Alexandria,"New Valley Governorate, Rehab City, El-Batal Ahmed Abdel Aziz St.",France,Italy,Bill Payment,EGP,399570830,2528,50.9,45.88,3.72,3792.0,Transfer,Successful
49695,254,198,257,2015-11-09T11:53:34.000Z,3,C959612513190880,Arab Jordan Investment Bank,"Luxor Governorate, Ain Shams, El-Gomhoreya St.",UAE,Egypt,Salary,EGP,227376675,10305,103.38,273.35,82.41,15457.5,Withdrawal,Successful
44695,1451,1124,272,2015-11-20T00:42:58.000Z,1,C381300911094895,Fransabank,"Damietta Governorate, El-Shorouk, Port Said St.",UK,Egypt,Transfer,EUR,392790272,15448,61.74,149.04,93.33,23172.0,Deposit,Rejected
14696,895,911,404,2015-05-06T21:17:28.000Z,3,C463224423251532,Commercial Bank of Qatar,"Marsa Matrouh Governorate, El-Marg, Talaat Harb St.",Canada,Egypt,Salary,EUR,935532448,11274,111.54,476.5,86.88,16911.0,Withdrawal,Rejected
9696,1252,644,383,2025-09-21T11:28:32.000Z,1,C148635381878099,Commercial Bank of Dubai,"Port Said Governorate, Faisal, El-Batal Ahmed Abdel Aziz St.",USA,Germany,Salary,EGP,499165968,17749,98.52,264.07,88.83,26623.5,Transfer,Rejected
24696,666,1018,499,2021-08-13T18:13:29.000Z,5,C994670396575888,First Abu Dhabi Bank Egypt,"Tanta Governorate, Hadayek El-Qobba, Talaat Harb St.",Australia,Spain,Salary,EUR,234415707,11351,93.38,63.03,72.35,17026.5,Transfer,Successful
39696,353,515,168,2020-05-18T22:53:20.000Z,4,C554049242961941,Gulf Bank Kuwait,"Port Said Governorate, Nasr City, El-Galaa St.",UAE,Egypt,Shopping,EGP,288365451,5640,109.52,251.31,98.45,8460.0,Withdrawal,Successful
19696,1248,1863,423,2023-04-28T01:38:48.000Z,7,C754739257887851,QNB Al Ahli,"Cairo Governorate, Madinaty, Merghany St.",Italy,Egypt,Shopping,USD,449138041,6661,82.3,178.2,93.45,9991.5,Withdrawal,Successful
29696,875,704,455,2023-03-07T20:15:59.000Z,3,C909217720711727,Housing and Development Bank (HDB),"Qena Governorate, Boulak, Ramses St.",Germany,Egypt,Transfer,EUR,203368711,10707,110.19,323.79,88.67,16060.5,Deposit,Rejected
34696,1899,1913,116,2020-04-14T17:13:23.000Z,4,C940320008859766,Al Baraka Bank Egypt,"Alexandria Governorate, Rehab City, Talaat Harb St.",France,Egypt,Bill Payment,EGP,893941398,5475,51.87,395.85,71.46,8212.5,Withdrawal,Rejected
49696,916,735,57,2018-01-29T08:45:21.000Z,3,C964475271801812,Al Baraka Bank Egypt,"Ismailia Governorate, Imbaba, El-Nasr St.",Canada,Egypt,Salary,EGP,111002935,14249,115.08,39.1,70.94,21373.5,Deposit,Successful
4696,646,416,361,2018-06-05T07:20:15.000Z,6,C683423511533304,BLOM Bank,"Minya Governorate, Matareya, Champollion St.",Saudi Arabia,Egypt,Shopping,EUR,484951089,13168,61.58,390.26,77.22,19752.0,Withdrawal,Rejected
44696,1235,305,500,2016-11-25T23:21:34.000Z,3,C302789568870366,Mashreq Bank,"Luxor Governorate, El-Sharabia, Emad El-Din St.",Egypt,Australia,Shopping,EUR,556623202,16383,61.25,144.9,84.4,24574.5,Transfer,Rejected
14697,1513,979,226,2019-06-06T18:19:35.000Z,5,C183234303997851,Suez Canal Bank,"Fayyum Governorate, El-Tagammu El-Khames, El-Nasr St.",Jordan,Germany,Transfer,USD,632332299,11935,92.21,391.63,73.89,17902.5,Transfer,Rejected
9697,843,743,326,2023-11-01T08:41:24.000Z,2,C794309215924262,Arab African International Bank (AAIB),"Cairo Governorate, Badr City, Corniche El-Nil St.",UK,Egypt,Transfer,EUR,204804136,18069,52.88,236.79,85.17,27103.5,Deposit,Successful
29697,73,1496,496,2016-09-01T07:45:19.000Z,4,C335516604606338,Arab Jordan Investment Bank,"New Valley Governorate, Dokki, Merghany St.",France,Egypt,Salary,EGP,877481768,4033,30.22,400.95,0.71,6049.5,Deposit,Rejected
24697,1598,443,415,2021-11-14T18:29:36.000Z,6,C899532231692428,National Bank of Kuwait,"Zagazig Governorate, El-Marg, El-Gomhoreya St.",Australia,Egypt,Salary,EGP,648659770,17895,24.94,449.07,77.85,26842.5,Deposit,Rejected
39697,872,411,317,2018-05-16T22:17:39.000Z,2,C379083731433696,First Abu Dhabi Bank Egypt,"Aswan Governorate, Dokki, El-Galaa St.",UK,Spain,Bill Payment,EGP,373615648,18073,108.48,82.66,76.11,27109.5,Transfer,Rejected
19697,258,1603,389,2019-08-01T05:15:34.000Z,1,C161812937264053,Fransabank,"Luxor Governorate, Ain Shams, El-Orouba St.",France,UK,Shopping,EGP,450443183,9804,15.28,340.69,85.59,14706.0,Transfer,Successful
44697,304,1425,450,2023-01-15T00:19:03.000Z,6,C785479266644898,Bank Misr,"Ismailia Governorate, Mohandiseen, Adly St.",Egypt,UK,Transfer,USD,262082862,17345,89.41,344.2,75.19,26017.5,Transfer,Rejected
4697,1975,219,218,2022-09-21T11:35:27.000Z,7,C913362808976409,Commercial International Bank (CIB),"Minya Governorate, Badr City, Abbas El-Akkad St.",USA,Egypt,Bill Payment,EGP,197318337,16545,1.66,299.63,88.97,24817.5,Withdrawal,Rejected
49697,329,1014,221,2023-08-24T13:02:39.000Z,5,C867581372952692,Jordan Ahli Bank,"Alexandria Governorate, Nasr City, El-Ahrar St.",Germany,Egypt,Transfer,USD,509354022,12326,10.49,152.89,97.54,18489.0,Withdrawal,Rejected
34697,1099,217,273,2016-03-05T11:52:40.000Z,1,C781286011457962,Commercial Bank of Dubai,"Mansoura Governorate, Boulak, Champollion St.",Saudi Arabia,Egypt,Bill Payment,EGP,836632405,10177,50.6,390.26,82.36,15265.5,Withdrawal,Rejected
14698,154,1309,213,2017-11-25T09:06:06.000Z,5,C920760239005686,Commercial Bank of Qatar,"Fayyum Governorate, Garden City, El-Ahrar St.",Saudi Arabia,Egypt,Salary,USD,315014214,13311,115.71,216.91,98.61,19966.5,Withdrawal,Successful
29698,647,581,438,2021-09-23T14:44:12.000Z,6,C430621959445823,Emirates NBD,"Beni Suef Governorate, Heliopolis, Merghany St.",Australia,Egypt,Shopping,EUR,674603142,7388,32.71,323.18,82.73,11082.0,Deposit,Rejected
9698,896,485,20,2016-01-13T06:34:23.000Z,2,C472024741495183,Suez Canal Bank,"Tanta Governorate, Hadayek El-Qobba, El-Gomhoreya St.",Germany,France,Transfer,EUR,824287542,12330,98.62,140.15,79.23,18495.0,Transfer,Rejected
24698,1389,886,295,2017-02-19T10:15:40.000Z,7,C628350972948096,Maged Gomaa Ramadan Kamal,"Fayyum Governorate, Mohandiseen, El-Tahrir St.",Germany,Egypt,Bill Payment,EUR,665102947,13952,8.95,348.16,73.85,20928.0,Withdrawal,Rejected
39698,967,1058,274,2021-02-25T08:47:15.000Z,1,C725285750812108,Kuwait Finance House,"Arish Governorate, Hadayek El-Qobba, El-Orouba St.",Spain,Italy,Bill Payment,EUR,169210146,15935,29.77,411.28,92.05,23902.5,Transfer,Rejected
19698,988,1031,320,2018-09-12T22:24:41.000Z,7,C151773317102340,Jordan Ahli Bank,"Hurghada Governorate, El-Salam, Sudan St.",Italy,Egypt,Shopping,EUR,586316143,10292,64.29,198.97,99.45,15438.0,Withdrawal,Successful
34698,989,1080,427,2023-03-11T16:54:07.000Z,3,C505331802204446,Commercial Bank of Qatar,"Luxor Governorate, Heliopolis, El-Ahrar St.",UAE,Germany,Shopping,USD,881079910,11923,99.39,373.3,87.75,17884.5,Transfer,Rejected
44698,723,949,62,2015-04-28T00:47:46.000Z,3,C556566793961738,Al Ahly Bank,"New Valley Governorate, Heliopolis, El-Alfy St.",Lebanon,Egypt,Salary,EGP,919700252,3654,94.98,123.51,28.46,5481.0,Withdrawal,Successful
4698,1162,1711,8,2018-01-22T15:44:25.000Z,3,C576131133327976,Housing and Development Bank (HDB),"Alexandria Governorate, Sheikh Zayed, Ramses St.",Lebanon,Canada,Transfer,EGP,451003336,1836,51.27,340.25,24.76,2754.0,Transfer,Rejected
49698,282,411,44,2015-02-03T02:11:42.000Z,6,C772095555126665,Banque du Caire,"Asyut Governorate, Garden City, Kasr El-Nil St.",Italy,Italy,Shopping,EGP,563512265,16724,43.43,448.4,76.37,25086.0,Transfer,Rejected
14699,131,1790,263,2015-10-13T12:51:39.000Z,2,C423626147779817,Emirates NBD,"Giza Governorate, 6th of October, Salah Salem St.",France,Italy,Salary,EUR,439677997,11031,0.89,357.22,83.82,16546.5,Transfer,Successful
24699,1480,285,388,2018-08-01T09:40:14.000Z,3,C886606983329446,Commercial Bank of Qatar,"Asyut Governorate, El-Shorouk, El-Azhar St.",Egypt,Egypt,Transfer,USD,597014113,11052,52.3,379.69,77.91,16578.0,Deposit,Rejected
9699,389,67,432,2023-03-03T10:28:59.000Z,4,C362511509877380,Commercial Bank of Qatar,"Arish Governorate, Heliopolis, Corniche El-Nil St.",USA,Egypt,Bill Payment,USD,490200908,9845,103.54,21.75,95.52,14767.5,Deposit,Rejected
39699,1552,1190,100,2017-01-17T23:22:07.000Z,1,C972132028623843,Samir Fawzy Abdel-Rahman Rashid,"Beni Suef Governorate, Badr City, El-Orouba St.",UK,Egypt,Bill Payment,USD,155495827,9527,54.17,300.59,98.49,14290.5,Withdrawal,Rejected
29699,872,411,176,2020-11-28T04:17:06.000Z,1,C568068348152836,Lotfy Rashid Fawzy Saleh,"Beni Suef Governorate, New Cairo, Kasr El-Nil St.",Lebanon,Australia,Salary,USD,965973802,8047,54.1,112.16,84.08,12070.5,Transfer,Rejected
19699,509,1815,341,2016-02-22T11:45:43.000Z,3,C545552577262917,Gulf Bank Kuwait,"Alexandria Governorate, Nasr City, Corniche El-Nil St.",UK,Egypt,Salary,EUR,411496652,7644,25.48,421.9,93.95,11466.0,Withdrawal,Rejected
34699,725,1819,267,2023-01-15T21:39:55.000Z,1,C857803782286687,Bank Misr,"Aswan Governorate, Matareya, El-Mohandiseen St.",Germany,Egypt,Transfer,EUR,620015630,15327,79.37,35.16,80.09,22990.5,Withdrawal,Rejected
44699,1564,848,149,2025-06-14T00:14:46.000Z,4,C152633044344168,Qatar National Bank (QNB),"Cairo Governorate, El-Salam, Port Said St.",Egypt,Germany,Salary,EGP,247016862,628,112.27,446.76,1.91,942.0,Transfer,Successful
4699,1797,189,60,2018-10-10T15:24:40.000Z,6,C291401945771686,Dubai Islamic Bank,"Shubra El-Kheima Governorate, El-Salam, El-Tahrir St.",Spain,Egypt,Transfer,USD,549031493,3604,92.41,472.31,29.19,5406.0,Withdrawal,Successful
49699,497,818,84,2016-10-23T04:52:00.000Z,7,C425826423638996,Mashreq Bank,"Fayyum Governorate, Nasr City, El-Bustan St.",USA,Egypt,Transfer,USD,347644588,17710,60.57,198.76,82.15,26565.0,Withdrawal,Rejected
14700,1877,780,327,2019-03-01T00:18:40.000Z,5,C526047154391434,First Abu Dhabi Bank (FAB),"Damietta Governorate, Badr City, El-Batal Ahmed Abdel Aziz St.",Saudi Arabia,Canada,Salary,USD,647735821,19707,111.01,370.24,75.76,29560.5,Transfer,Rejected
9700,1998,73,181,2015-01-15T07:55:49.000Z,1,C350426170882151,Fransabank,"Marsa Matrouh Governorate, El-Sharabia, Abbas El-Akkad St.",France,Egypt,Shopping,EUR,358358654,786,57.45,224.91,37.84,1179.0,Deposit,Rejected
29700,15,1258,364,2022-08-23T16:40:52.000Z,7,C241716420562273,Lebanese French Bank (LFB),"Sohag Governorate, Garden City, Makram Ebeid St.",Italy,UK,Transfer,USD,100068227,4344,119.2,459.48,39.55,6516.0,Transfer,Rejected
19700,1753,1464,63,2021-11-14T18:45:33.000Z,5,C665770209806916,Arab Bank,"New Valley Governorate, El-Haram, El-Haram St.",Germany,Australia,Shopping,USD,772691148,13497,0.17,432.02,96.48,20245.5,Transfer,Rejected
39700,1171,560,316,2017-03-11T06:42:32.000Z,7,C246634120143067,Arab National Bank,"Damanhur Governorate, El-Tagammu El-Khames, Port Said St.",Italy,Egypt,Salary,EUR,334436071,9440,108.88,12.44,73.87,14160.0,Deposit,Successful
24700,962,646,453,2015-10-23T21:27:51.000Z,2,C538043522267122,Neveen Saad Morsy Qassem,"Shubra El-Kheima Governorate, Faisal, El-Azhar St.",Lebanon,Egypt,Transfer,EGP,922238703,5834,36.25,18.71,91.0,8751.0,Withdrawal,Successful
44700,605,1939,55,2019-04-16T07:52:58.000Z,1,C200810370956122,National Bank of Kuwait,"Hurghada Governorate, 6th of October, Merghany St.",Germany,Germany,Transfer,USD,988870807,10352,71.08,306.0,98.16,15528.0,Transfer,Rejected
49700,874,377,226,2020-05-05T14:50:29.000Z,1,C755736181194102,Arab Jordan Investment Bank,"Fayyum Governorate, El-Tagammu El-Khames, El-Nasr St.",France,UK,Transfer,EGP,293445180,2525,108.19,133.53,25.07,3787.5,Transfer,Successful
34700,329,1578,223,2026-04-25T06:31:33.000Z,2,C244552132430818,Saudi National Bank (SNB),"Ismailia Governorate, Nasr City, El-Nasr St.",Egypt,France,Shopping,EUR,735951634,14382,11.35,17.3,91.9,21573.0,Transfer,Successful
4700,708,711,458,2018-01-18T18:18:46.000Z,3,C257962226192840,Commercial International Bank (CIB),"Shubra El-Kheima Governorate, Sheikh Zayed, El-Ahrar St.",Egypt,Italy,Salary,USD,528861243,14640,86.24,478.9,70.35,21960.0,Transfer,Rejected
14701,1376,460,212,2026-01-10T09:01:07.000Z,1,C848015225981161,Shereen Sobhi Helal Abdel-Rahman,"Port Said Governorate, Dokki, Corniche El-Nil St.",Australia,Australia,Bill Payment,EGP,983083161,943,104.21,216.15,31.64,1414.5,Transfer,Successful
9701,1147,792,250,2016-11-24T22:26:20.000Z,4,C285247676980199,Arab Investment Bank,"Asyut Governorate, Faisal, El-Ahrar St.",USA,Egypt,Transfer,EGP,471343622,10354,37.09,152.74,70.84,15531.0,Deposit,Rejected
39701,1266,1527,402,2024-08-08T14:02:17.000Z,5,C120076741960727,Kuwait Finance House,"Alexandria Governorate, El-Marg, El-Alfy St.",Egypt,Germany,Bill Payment,USD,198471339,6227,98.86,481.57,99.81,9340.5,Transfer,Rejected
24701,1966,1175,469,2019-07-28T11:56:26.000Z,3,C733311607982230,Hazem Mansour Nasser Zidan,"Luxor Governorate, Badr City, Sudan St.",France,Egypt,Transfer,EGP,382738316,18626,113.44,215.8,82.78,27939.0,Deposit,Successful
29701,1305,1096,222,2015-05-18T12:55:47.000Z,3,C372385788349708,Banque du Caire,"Hurghada Governorate, Faisal, El-Galaa St.",Canada,Egypt,Transfer,EUR,689797081,11025,13.79,290.09,87.38,16537.5,Withdrawal,Rejected
19701,1120,867,386,2017-08-14T21:36:27.000Z,3,C198699584683808,Kuwait Finance House,"Mansoura Governorate, Zamalek, Kasr El-Nil St.",Australia,Egypt,Transfer,EUR,258724621,14981,57.38,133.76,92.98,22471.5,Deposit,Rejected
34701,1358,32,406,2018-04-08T16:02:59.000Z,7,C915576593116945,Citibank,"Mansoura Governorate, Mohandiseen, El-Orouba St.",UAE,Egypt,Bill Payment,EUR,112286393,15232,51.68,115.88,96.28,22848.0,Deposit,Rejected
4701,1617,1277,75,2025-01-06T21:06:23.000Z,5,C583176232690564,First Abu Dhabi Bank (FAB),"Zagazig Governorate, 6th of October, El-Gomhoreya St.",Germany,Egypt,Transfer,EGP,669864109,19136,70.24,139.44,89.67,28704.0,Deposit,Rejected
49701,1872,944,107,2018-08-01T00:04:28.000Z,3,C753711832536402,Bank Audi,"New Valley Governorate, Sheikh Zayed, El-Safwa St.",Germany,Egypt,Salary,EUR,899462653,5726,100.34,46.76,71.06,8589.0,Withdrawal,Rejected
44701,1978,1136,331,2017-09-26T15:24:40.000Z,2,C948940957579207,Mashreq Bank,"Sohag Governorate, El-Salam, Merghany St.",UK,Egypt,Shopping,EGP,499751618,18177,79.36,13.29,87.05,27265.5,Withdrawal,Successful
14702,918,1458,382,2015-12-13T05:16:29.000Z,4,C739657404877030,Ahli United Bank Kuwait,"Fayyum Governorate, Hadayek El-Qobba, Port Said St.",UK,Canada,Transfer,EGP,806678829,5407,54.57,35.26,91.62,8110.5,Transfer,Rejected
9702,668,1806,465,2020-12-20T08:49:20.000Z,4,C512804151439719,First Abu Dhabi Bank (FAB),"New Valley Governorate, El-Salam, Ramses St.",Jordan,Egypt,Bill Payment,EGP,785453390,430,40.33,123.09,18.98,645.0,Deposit,Rejected
39702,770,1856,133,2023-05-17T01:58:29.000Z,5,C937288766286357,Fransabank,"Damietta Governorate, Zamalek, Champollion St.",Spain,Egypt,Transfer,EGP,953599510,13402,8.63,347.65,90.54,20103.0,Withdrawal,Successful
29702,1395,1251,285,2021-03-04T03:29:23.000Z,7,C479188044125644,Kuwait Finance House,"Giza Governorate, El-Marg, El-Orouba St.",Lebanon,Egypt,Salary,EUR,173342367,2228,112.17,218.3,14.19,3342.0,Withdrawal,Successful
19702,793,1318,167,2020-02-10T12:19:50.000Z,6,C805335132962659,Commercial Bank of Dubai,"Sohag Governorate, Agouza, El-Galaa St.",UAE,Australia,Bill Payment,EGP,861493618,10292,44.42,269.07,82.55,15438.0,Transfer,Successful
24702,1738,398,196,2015-07-17T17:19:27.000Z,4,C923305524961444,Dubai Islamic Bank,"Giza Governorate, Agouza, Kasr El-Nil St.",Italy,USA,Salary,EUR,168686872,18870,54.93,243.75,89.34,28305.0,Transfer,Successful
34702,892,598,44,2019-10-24T05:44:39.000Z,7,C748516135984374,Commercial Bank of Qatar,"Asyut Governorate, Garden City, Kasr El-Nil St.",USA,Egypt,Transfer,EGP,538401526,14825,84.61,355.47,88.68,22237.5,Withdrawal,Successful
49702,1037,1508,270,2025-12-31T11:41:31.000Z,6,C850787499984695,Commercial Bank of Dubai,"Sohag Governorate, El-Basatin, El-Haram St.",Australia,Germany,Shopping,EGP,399077734,12204,61.36,89.09,74.5,18306.0,Transfer,Rejected
44702,109,134,139,2024-02-28T08:45:24.000Z,5,C270035811734955,Commercial International Bank (CIB),"New Valley Governorate, Madinaty, Champollion St.",Lebanon,UK,Shopping,EUR,831594334,19456,54.95,32.29,93.01,29184.0,Transfer,Rejected
4702,450,1953,236,2024-04-01T03:08:33.000Z,6,C869989015344039,Commercial Bank of Dubai,"Sohag Governorate, El-Shorouk, Makram Ebeid St.",Canada,Germany,Bill Payment,EGP,455908343,691,62.99,256.4,12.48,1036.5,Transfer,Successful
14703,296,197,280,2020-06-02T21:35:11.000Z,1,C323571821886354,Al Baraka Bank Egypt,"Hurghada Governorate, 6th of October, Champollion St.",Lebanon,Egypt,Transfer,USD,205302725,18154,69.84,260.59,80.75,27231.0,Deposit,Rejected
29703,1641,414,106,2024-01-04T17:22:29.000Z,4,C755460357048774,Mashreq Bank,"Damietta Governorate, Shubra, Gamal Abdel Nasser St.",Italy,Egypt,Salary,USD,613984054,2298,111.89,380.16,30.52,3447.0,Deposit,Rejected
19703,1162,705,238,2018-03-20T03:39:21.000Z,4,C530634591499343,National Commercial Bank (NCB),"Minya Governorate, Matareya, Corniche El-Nil St.",Egypt,Egypt,Bill Payment,USD,924962094,9557,25.14,269.84,75.63,14335.5,Deposit,Successful
9703,569,638,422,2022-01-28T02:23:54.000Z,1,C612017473195601,Standard Chartered,"Damanhur Governorate, Badr City, Talaat Harb St.",Lebanon,Egypt,Bill Payment,USD,735711012,17808,85.63,65.14,95.1,26712.0,Deposit,Successful
39703,1474,44,240,2017-12-27T07:05:05.000Z,5,C622658528860864,Al Ahly Bank,"Damietta Governorate, Mohandiseen, Adly St.",Italy,Italy,Shopping,USD,127862471,6324,13.05,273.67,91.28,9486.0,Transfer,Rejected
24703,1404,367,346,2025-05-02T21:10:12.000Z,5,C433962958519446,QNB Al Ahli,"New Valley Governorate, El-Haram, Emad El-Din St.",France,Italy,Shopping,EGP,717240328,14575,90.4,444.32,92.11,21862.5,Transfer,Rejected
44703,361,6,234,2021-07-16T09:59:13.000Z,6,C488585104602758,National Commercial Bank (NCB),"Ismailia Governorate, El-Obour City, Cleopatra St.",USA,Egypt,Shopping,USD,584811403,15457,105.48,111.57,96.81,23185.5,Withdrawal,Successful
49703,1159,1293,418,2018-03-26T22:04:50.000Z,4,C805739286249755,Suez Canal Bank,"Marsa Matrouh Governorate, Shubra, Merghany St.",Saudi Arabia,Egypt,Salary,EUR,546260447,4484,87.44,177.35,6.81,6726.0,Withdrawal,Rejected
4703,367,57,478,2024-09-16T19:30:39.000Z,7,C911260924003014,Suez Canal Bank,"Beni Suef Governorate, El-Haram, El-Haram St.",UK,Egypt,Bill Payment,USD,689803389,2378,116.41,252.07,13.76,3567.0,Deposit,Rejected
34703,1061,1128,110,2025-04-17T10:32:41.000Z,6,C814203973996990,Fatima Kamal Sobhi Naguib,"Suez Governorate, Shubra, Gamal Abdel Nasser St.",Canada,Germany,Bill Payment,EUR,426022231,8264,68.83,125.47,85.68,12396.0,Transfer,Successful
14704,1377,1296,48,2017-08-24T22:05:58.000Z,2,C799522484325066,Ahli United Bank Egypt,"Shubra El-Kheima Governorate, Badr City, El-Alfy St.",Saudi Arabia,Italy,Shopping,EUR,585586497,7876,91.15,152.14,75.88,11814.0,Transfer,Rejected
9704,823,976,306,2021-01-14T00:08:20.000Z,5,C648882157650092,QNB Al Ahli,"Damanhur Governorate, El-Marg, Champollion St.",Egypt,Egypt,Transfer,USD,148989470,18316,88.47,325.85,97.05,27474.0,Withdrawal,Rejected
24704,904,1668,211,2018-10-15T11:57:42.000Z,4,C860900558655851,Jordan Ahli Bank,"Aswan Governorate, El-Salam, El-Alfy St.",France,Egypt,Bill Payment,EUR,909219614,13688,52.27,326.91,82.54,20532.0,Deposit,Successful
39704,943,1887,360,2026-04-14T01:28:21.000Z,5,C494602144939636,Bassem Gaber Bishara Eid,"Marsa Matrouh Governorate, Boulak, El-Azhar St.",Italy,Canada,Salary,EUR,115587052,14159,38.78,388.2,80.52,21238.5,Transfer,Rejected
19704,876,257,124,2020-11-10T06:10:16.000Z,6,C964725353479068,QNB Al Ahli,"Arish Governorate, Rehab City, Port Said St.",Australia,Egypt,Bill Payment,EUR,208722641,5012,94.64,259.14,99.36,7518.0,Withdrawal,Successful
29704,1264,1606,385,2015-01-25T10:22:52.000Z,7,C216761579399413,Arab National Bank,"Mansoura Governorate, Zamalek, Adly St.",Saudi Arabia,Australia,Salary,USD,470962179,715,28.83,159.09,22.6,1072.5,Transfer,Rejected
34704,1346,1487,202,2024-01-07T16:22:32.000Z,3,C912472049374979,Emirates NBD,"Cairo Governorate, El-Salam, Salah Salem St.",UAE,Egypt,Salary,EUR,846993057,828,38.2,222.8,0.43,1242.0,Withdrawal,Rejected
44704,1248,102,375,2020-11-29T04:26:30.000Z,1,C800392367171604,Byblos Bank,"Minya Governorate, Shubra, El-Orouba St.",UK,Italy,Shopping,EUR,515344214,3064,36.37,357.0,28.41,4596.0,Transfer,Rejected
4704,344,1970,32,2026-02-22T19:37:10.000Z,4,C625267635639177,Dubai Islamic Bank,"Damietta Governorate, Garden City, Gamal Abdel Nasser St.",Germany,Egypt,Salary,EUR,728939064,18810,31.07,419.77,91.98,28215.0,Deposit,Rejected
49704,489,1732,8,2018-02-23T12:53:31.000Z,6,C918070819325580,Commercial Bank of Qatar,"Alexandria Governorate, Sheikh Zayed, Ramses St.",Australia,Egypt,Shopping,EGP,580248115,2422,81.33,47.55,24.8,3633.0,Deposit,Successful
14705,1480,240,42,2017-11-01T23:15:16.000Z,1,C362408948834979,Arab Jordan Investment Bank,"Alexandria Governorate, Imbaba, El-Azhar St.",Lebanon,Egypt,Transfer,EGP,372227838,8824,86.86,301.77,87.78,13236.0,Withdrawal,Rejected
9705,334,283,315,2017-08-08T05:30:49.000Z,6,C612052332415489,Commercial Bank of Dubai,"Ismailia Governorate, Zamalek, El-Galaa St.",UAE,Egypt,Shopping,EUR,906596547,14129,87.53,235.6,95.67,21193.5,Withdrawal,Rejected
19705,1439,1891,31,2019-08-06T15:18:43.000Z,2,C202773273887743,Commercial Bank of Qatar,"Zagazig Governorate, El-Sharabia, Salah Salem St.",Germany,Egypt,Shopping,EUR,457013983,16265,54.5,201.46,85.65,24397.5,Withdrawal,Rejected
24705,960,1303,446,2017-08-01T11:57:03.000Z,5,C643185948415226,Commercial Bank of Qatar,"Tanta Governorate, Rehab City, El-Azhar St.",Lebanon,Egypt,Salary,USD,888162356,284,11.48,460.96,36.54,426.0,Deposit,Rejected
39705,884,1997,266,2016-04-08T09:31:53.000Z,5,C988038310632801,National Commercial Bank (NCB),"Minya Governorate, El-Sharabia, El-Bustan St.",Egypt,Egypt,Shopping,USD,495767782,4476,23.83,151.28,9.33,6714.0,Withdrawal,Rejected
29705,836,1809,354,2024-07-24T06:27:50.000Z,1,C591203633992167,First Abu Dhabi Bank (FAB),"Qena Governorate, Matareya, Gamal Abdel Nasser St.",Egypt,UK,Bill Payment,USD,188996620,18183,49.82,415.39,77.0,27274.5,Transfer,Rejected
44705,649,1582,486,2015-09-01T20:01:02.000Z,2,C341395670283049,Saudi National Bank (SNB),"Ismailia Governorate, El-Haram, Emad El-Din St.",USA,Egypt,Transfer,EGP,997080805,597,68.03,169.17,27.61,895.5,Deposit,Rejected
34705,541,1332,331,2023-10-22T05:50:55.000Z,7,C185378625800948,Qatar National Bank (QNB),"Sohag Governorate, El-Salam, Merghany St.",Germany,Egypt,Salary,USD,562128779,337,111.56,492.68,37.5,505.5,Deposit,Rejected
49705,948,692,158,2022-01-18T07:36:30.000Z,7,C852885583384949,Arab Bank,"Asyut Governorate, El-Haram, Salah Salem St.",Lebanon,Egypt,Salary,USD,278299855,15898,12.09,390.84,86.51,23847.0,Deposit,Rejected
4705,736,1033,152,2021-12-27T08:57:19.000Z,2,C995879978749403,First Abu Dhabi Bank (FAB),"Arish Governorate, Omraneya, Salah Salem St.",USA,Egypt,Salary,USD,754301395,4305,1.05,47.31,9.67,6457.5,Withdrawal,Successful
14706,179,414,340,2022-09-19T04:26:20.000Z,5,C788787554851442,QNB Al Ahli,"Sohag Governorate, Mohandiseen, Talaat Harb St.",Saudi Arabia,Canada,Salary,EUR,500704730,19542,48.28,219.74,79.16,29313.0,Transfer,Successful
29706,1311,153,166,2020-02-16T17:01:33.000Z,1,C760658940409841,Commercial Bank of Dubai,"Giza Governorate, Ain Shams, El-Batal Ahmed Abdel Aziz St.",Saudi Arabia,Egypt,Transfer,USD,327338304,10720,110.16,219.57,83.21,16080.0,Deposit,Successful
39706,325,410,209,2022-02-26T10:33:33.000Z,4,C365959534023020,Commercial Bank of Qatar,"Port Said Governorate, Hadayek El-Qobba, Cleopatra St.",UAE,Egypt,Transfer,USD,103306104,11198,54.83,128.69,94.04,16797.0,Withdrawal,Successful
24706,1766,755,248,2023-01-22T17:08:14.000Z,7,C151089045389631,Ahli United Bank Kuwait,"Suez Governorate, Zamalek, El-Nasr St.",Germany,Germany,Salary,EUR,226693909,14640,1.25,218.83,84.18,21960.0,Transfer,Rejected
9706,1815,1269,447,2015-01-29T09:57:06.000Z,7,C513049017467876,Emirates NBD Egypt,"Fayyum Governorate, Maadi, Adly St.",France,Egypt,Bill Payment,USD,455859126,12722,65.8,61.72,71.95,19083.0,Deposit,Rejected
19706,799,1864,198,2023-06-04T05:13:44.000Z,4,C433595056181684,Lebanese French Bank (LFB),"Ismailia Governorate, Dokki, El-Galaa St.",Germany,Egypt,Shopping,USD,149886417,5425,63.18,329.52,70.99,8137.5,Withdrawal,Rejected
44706,162,1711,317,2022-02-03T17:51:26.000Z,6,C358765712618312,Lebanese French Bank (LFB),"Aswan Governorate, Dokki, El-Galaa St.",Spain,Egypt,Shopping,EUR,241713959,17172,67.74,458.93,90.4,25758.0,Withdrawal,Successful
34706,505,619,82,2021-08-13T19:03:09.000Z,2,C765805548160173,National Bank of Egypt,"Zagazig Governorate, El-Obour City, El-Galaa St.",Australia,Germany,Shopping,EUR,319785799,14262,64.58,342.49,98.19,21393.0,Transfer,Rejected
4706,1396,480,310,2017-09-20T12:36:17.000Z,6,C367212157778474,Dubai Islamic Bank,"Mansoura Governorate, Mohandiseen, El-Nasr St.",Jordan,USA,Transfer,USD,763945412,15784,106.68,419.7,72.73,23676.0,Transfer,Rejected
49706,684,1090,260,2024-11-04T23:24:54.000Z,6,C314047976191983,Faisal Islamic Bank of Egypt,"Cairo Governorate, Dokki, El-Alfy St.",Egypt,Australia,Shopping,USD,714483786,1475,23.23,337.27,25.68,2212.5,Transfer,Successful
